{
  "schema":"robot-control/hil-case-evidence/v1","session_id":"HIL-20260805-112019","case_id":"STOP-001","attempt_id":"attempt-1",
  "context":{"robot_id":"mrobots-4.1-5C67039168","source_revision":"4d846dd4b8d2940da4a340fb8606d8dd70b31b66","manifest_sha256":"8a005ffa6ffc7784ff813e0730fb70295b4c4799e409d8447d5debe66f41809f","config_sha256":"46e8ac64814c2e5d1f7faa9e14c6115d750436ccedaca1c27de4961937fc90d9"},
  "started_at":"2026-08-05T03:23:34Z","ended_at":"2026-08-05T03:23:38Z","status":"PASS","nonzero_emitted":false,
  "measurements":[{"stop_attempts":3,"observer_message_count":1,"observer_nonzero_count":0,"publisher_after":[]}],
  "stop_evidence":{"attempted":true,"result":"Zero velocity confirmed; observer saw zero only and no publisher remained."},
  "artifacts":[{"path":"logs/STOP-001-observer.json","kind":"log","sha256":"14c361b58f15b2fa23e3c38d4bdfcd3e77e813678c4a70a5f4045073eb78990c","contains_secrets":false}],
  "rationale":"The normal-readiness explicit stop path produced only zero velocity and cleaned up its publisher."
}
