{
  "schema":"robot-control/hil-case-evidence/v1","session_id":"HIL-20260805-112019","case_id":"DIR-AZP","attempt_id":"attempt-1",
  "context":{"robot_id":"mrobots-4.1-5C67039168","source_revision":"4d846dd4b8d2940da4a340fb8606d8dd70b31b66","manifest_sha256":"8a005ffa6ffc7784ff813e0730fb70295b4c4799e409d8447d5debe66f41809f","config_sha256":"46e8ac64814c2e5d1f7faa9e14c6115d750436ccedaca1c27de4961937fc90d9"},
  "proposal_id":"DIR-AZP-attempt-1","operator_authorization":{"operator":"张峻翔","phrase":"走","authorized_at":"2026-08-05T03:33:28Z","consumed_at":"2026-08-05T03:33:28Z"},
  "started_at":"2026-08-05T03:33:28Z","ended_at":"2026-08-05T03:33:31Z","status":"BLOCKED","nonzero_emitted":true,"request_path":null,"result_path":null,
  "measurements":[{"angular_z_radps":0.15,"duration_s":2.0,"theoretical_rotation_rad":0.3,"theoretical_rotation_deg":17.2,"minimum_all_sector_clearance_m":1.04325,"publish_count":17,"observer_nonzero_count":15,"physical_direction":"Counterclockwise observed without reported anomaly","independent_angle_deg":null}],
  "stop_evidence":{"attempted":true,"result":"Three zero attempts confirmed; observer last message was zero; /cmd_vel had no publisher after exit."},
  "artifacts":[{"path":"logs/DIR-AZP-attempt-1-observer.json","kind":"log","sha256":"c1cda2b92972f72badd42d4c36efb4b3dff15432bc58861f93c381e45230981e","contains_secrets":false}],
  "rationale":"Rotation sign and digital stop behavior were accepted on site, but independent angle and video evidence remain pending."
}
