{
  "schema":"robot-control/hil-case-evidence/v1","session_id":"HIL-20260805-112019","case_id":"PRE-001","attempt_id":"attempt-1",
  "context":{"robot_id":"mrobots-4.1-5C67039168","source_revision":"4d846dd4b8d2940da4a340fb8606d8dd70b31b66","manifest_sha256":"8a005ffa6ffc7784ff813e0730fb70295b4c4799e409d8447d5debe66f41809f","config_sha256":"46e8ac64814c2e5d1f7faa9e14c6115d750436ccedaca1c27de4961937fc90d9"},
  "started_at":"2026-08-05T03:20:19Z","ended_at":"2026-08-05T03:20:21Z","status":"PASS","nonzero_emitted":false,
  "measurements":[{"board":"kaihongboard-3588s@172.20.10.5","kernel":"Linux 5.10.110-ab52 aarch64","ssh_port":2223,"deployment_root":"/data/local/robot/jx/control_ws"}],
  "stop_evidence":{"attempted":false,"result":"Identity preflight was read-only."},"artifacts":[],
  "rationale":"Board, source revision, manifest and measured configuration identity were bound to the session."
}
