{
  "schema":"robot-control/hil-case-evidence/v1","session_id":"HIL-20260805-112019","case_id":"DIR-YP","attempt_id":"attempt-2",
  "context":{"robot_id":"mrobots-4.1-5C67039168","source_revision":"4d846dd4b8d2940da4a340fb8606d8dd70b31b66","manifest_sha256":"8a005ffa6ffc7784ff813e0730fb70295b4c4799e409d8447d5debe66f41809f","config_sha256":"46e8ac64814c2e5d1f7faa9e14c6115d750436ccedaca1c27de4961937fc90d9"},
  "proposal_id":"DIR-YP-attempt-2","operator_authorization":{"operator":"张峻翔","phrase":"走","authorized_at":"2026-08-05T03:31:45Z","consumed_at":"2026-08-05T03:31:45Z"},
  "started_at":"2026-08-05T03:31:45Z","ended_at":"2026-08-05T03:31:48Z","status":"BLOCKED","nonzero_emitted":true,"request_path":null,"result_path":null,
  "measurements":[{"linear_y_mps":0.1,"duration_s":2.0,"theoretical_displacement_m":0.2,"left_clearance_m":1.465,"publish_count":17,"observer_nonzero_count":16,"physical_direction":"Left observed without reported anomaly","independent_distance_m":null}],
  "stop_evidence":{"attempted":true,"result":"Three zero attempts confirmed; observer last message was zero; /cmd_vel had no publisher after exit."},
  "artifacts":[{"path":"logs/DIR-YP-attempt-2-observer.json","kind":"log","sha256":"96414967467348bffd39267175da36f186f8ac44e1c57770e35334738aeb030d","contains_secrets":false}],
  "rationale":"Direction and digital stop behavior were accepted on site, but independent displacement and video evidence remain pending."
}
