{
  "schema":"robot-control/hil-case-evidence/v1","session_id":"HIL-20260805-112019","case_id":"ESTOP-003","attempt_id":"attempt-1",
  "context":{"robot_id":"mrobots-4.1-5C67039168","source_revision":"4d846dd4b8d2940da4a340fb8606d8dd70b31b66","manifest_sha256":"8a005ffa6ffc7784ff813e0730fb70295b4c4799e409d8447d5debe66f41809f","config_sha256":"46e8ac64814c2e5d1f7faa9e14c6115d750436ccedaca1c27de4961937fc90d9"},
  "started_at":"2026-08-05T03:37:03Z","ended_at":"2026-08-05T03:37:14Z","status":"PASS","nonzero_emitted":false,
  "measurements":[{"lidar_healthcheck":"PASS","required_clear_frames":3,"reset_ok":true,"latched_after":false,"final_scan":"SCAN_READY"}],
  "stop_evidence":{"attempted":false,"result":"estop-reset evaluated three fresh frames without publishing velocity."},"artifacts":[],
  "rationale":"After lidar recovery, three consecutive fresh all-direction-clear frames completed reset and final status was clear."
}
